{
  "bars": {
    "daily_completed_count": 10,
    "daily_endpoint_close_time": "2026-01-30T00:00:00Z",
    "excluded_incomplete_count": 0,
    "signal_bar_close_time": "2026-02-07T20:00:00Z",
    "signal_completed_count": 35
  },
  "candidates": {
    "buy": {
      "contract_status": "METADATA_UNAVAILABLE",
      "direction": "BUY",
      "display_size": null,
      "entry_reference": 351.0,
      "monetary_loss_per_one_contract": null,
      "provider_adjusted_stop": 336.8,
      "raw_size": null,
      "raw_strategy_stop": 336.8,
      "risk_distance": 14.2,
      "target_3r": 393.6,
      "target_risk_usd": 100.0
    },
    "sell": null
  },
  "case_id": "confirmed_buy_h4_02",
  "classification": {
    "buy_filter_matched": true,
    "buy_sma_rejection": true,
    "buy_structural_pivot": true,
    "confirmed_buy": true,
    "confirmed_sell": false,
    "dashboard_state": "CONFIRMED_BUY",
    "sell_filter_matched": false,
    "sell_sma_rejection": false,
    "sell_structural_pivot": true,
    "technical_buy_signal": true,
    "technical_sell_signal": false
  },
  "data_status": "READY",
  "evaluation_time": "2026-02-07T20:00:01Z",
  "evidence": [
    "Only provider-complete candles closing before the evaluation boundary were used.",
    "H4 and D1 calculations were evaluated independently of any other signal timeframe.",
    "The Daily Filter is non-consuming; reverse-filter and risk-multiplier logic are absent."
  ],
  "indicators": {
    "activation_buffer": 0.8,
    "atr_d1_wilder_5": 16.0,
    "daily_buy_level": 342.8,
    "daily_raw_high": 358.0,
    "daily_raw_low": 342.0,
    "daily_sell_level": 357.2,
    "point_adjustment": 0.1,
    "recent_high_21": 353.0,
    "recent_low_21": 342.5,
    "sma10": 350.1,
    "sma20": 350.05,
    "stop_atr_distance": 5.6
  },
  "instrument_id": "SYNTH_XAUUSD",
  "issues": [],
  "pivots": {
    "buy": {
      "open_time": "2026-02-07T16:00:00Z",
      "passed": true,
      "pivot_value": 342.5,
      "structural_window_extreme": 342.5
    },
    "sell": {
      "open_time": "2026-02-07T12:00:00Z",
      "passed": true,
      "pivot_value": 353.0,
      "structural_window_extreme": 353.0
    }
  },
  "strategy_id": "SPECT8_MICRO_DAILY_V1_0",
  "timeframe": "H4"
}
